title,link,price,thumbnail,rating
A Light in the Attic,catalogue/a-light-in-the-attic_1000/index.html,£51.77,media/cache/2c/da/2cdad67c44b002e7ead0cc35693c0e8b.jpg,3
Tipping the Velvet,catalogue/tipping-the-velvet_999/index.html,£53.74,media/cache/26/0c/260c6ae16bce31c8f8c95daddd9f4a1c.jpg,1
Soumission,catalogue/soumission_998/index.html,£50.10,media/cache/3e/ef/3eef99c9d9adef34639f510662022830.jpg,1
Sharp Objects,catalogue/sharp-objects_997/index.html,£47.82,media/cache/32/51/3251cf3a3412f53f339e42cac2134093.jpg,4
Sapiens: A Brief History of Humankind,catalogue/sapiens-a-brief-history-of-humankind_996/index.html,£54.23,media/cache/be/a5/bea5697f2534a2f86a3ef27b5a8c12a6.jpg,5
The Requiem Red,catalogue/the-requiem-red_995/index.html,£22.65,media/cache/68/33/68339b4c9bc034267e1da611ab3b34f8.jpg,1
The Dirty Little Secrets of Getting Your Dream Job,catalogue/the-dirty-little-secrets-of-getting-your-dream-job_994/index.html,£33.34,media/cache/92/27/92274a95b7c251fea59a2b8a78275ab4.jpg,4
"The Coming Woman: A Novel Based on the Life of the Infamous Feminist, Victoria Woodhull",catalogue/the-coming-woman-a-novel-based-on-the-life-of-the-infamous-feminist-victoria-woodhull_993/index.html,£17.93,media/cache/3d/54/3d54940e57e662c4dd1f3ff00c78cc64.jpg,3
The Boys in the Boat: Nine Americans and Their Epic Quest for Gold at the 1936 Berlin Olympics,catalogue/the-boys-in-the-boat-nine-americans-and-their-epic-quest-for-gold-at-the-1936-berlin-olympics_992/index.html,£22.60,media/cache/66/88/66883b91f6804b2323c8369331cb7dd1.jpg,4
The Black Maria,catalogue/the-black-maria_991/index.html,£52.15,media/cache/58/46/5846057e28022268153beff6d352b06c.jpg,1
"Starving Hearts (Triangular Trade Trilogy, #1)",catalogue/starving-hearts-triangular-trade-trilogy-1_990/index.html,£13.99,media/cache/be/f4/bef44da28c98f905a3ebec0b87be8530.jpg,2
Shakespeare's Sonnets,catalogue/shakespeares-sonnets_989/index.html,£20.66,media/cache/10/48/1048f63d3b5061cd2f424d20b3f9b666.jpg,4
Set Me Free,catalogue/set-me-free_988/index.html,£17.46,media/cache/5b/88/5b88c52633f53cacf162c15f4f823153.jpg,5
Scott Pilgrim's Precious Little Life (Scott Pilgrim #1),catalogue/scott-pilgrims-precious-little-life-scott-pilgrim-1_987/index.html,£52.29,media/cache/94/b1/94b1b8b244bce9677c2f29ccc890d4d2.jpg,5
Rip it Up and Start Again,catalogue/rip-it-up-and-start-again_986/index.html,£35.02,media/cache/81/c4/81c4a973364e17d01f217e1188253d5e.jpg,5
"Our Band Could Be Your Life: Scenes from the American Indie Underground, 1981-1991",catalogue/our-band-could-be-your-life-scenes-from-the-american-indie-underground-1981-1991_985/index.html,£57.25,media/cache/54/60/54607fe8945897cdcced0044103b10b6.jpg,3
Olio,catalogue/olio_984/index.html,£23.88,media/cache/55/33/553310a7162dfbc2c6d19a84da0df9e1.jpg,1
Mesaerion: The Best Science Fiction Stories 1800-1849,catalogue/mesaerion-the-best-science-fiction-stories-1800-1849_983/index.html,£37.59,media/cache/09/a3/09a3aef48557576e1a85ba7efea8ecb7.jpg,1
Libertarianism for Beginners,catalogue/libertarianism-for-beginners_982/index.html,£51.33,media/cache/0b/bc/0bbcd0a6f4bcd81ccb1049a52736406e.jpg,2
It's Only the Himalayas,catalogue/its-only-the-himalayas_981/index.html,£45.17,media/cache/27/a5/27a53d0bb95bdd88288eaf66c9230d7e.jpg,2
In Her Wake,in-her-wake_980/index.html,£12.84,../media/cache/5d/72/5d72709c6a7a9584a4d1cf07648bfce1.jpg,1
How Music Works,how-music-works_979/index.html,£37.32,../media/cache/5c/c8/5cc8e107246cb478960d4f0aba1e1c8e.jpg,2
"Foolproof Preserving: A Guide to Small Batch Jams, Jellies, Pickles, Condiments, and More: A Foolproof Guide to Making Small Batch Jams, Jellies, Pickles, Condiments, and More",foolproof-preserving-a-guide-to-small-batch-jams-jellies-pickles-condiments-and-more-a-foolproof-guide-to-making-small-batch-jams-jellies-pickles-condiments-and-more_978/index.html,£30.52,../media/cache/9f/59/9f59f01fa916a7bb8f0b28a4012179a4.jpg,3
Chase Me (Paris Nights #2),chase-me-paris-nights-2_977/index.html,£25.27,../media/cache/9c/2e/9c2e0eb8866b8e3f3b768994fd3d1c1a.jpg,5
Black Dust,black-dust_976/index.html,£34.53,../media/cache/44/cc/44ccc99c8f82c33d4f9d2afa4ef25787.jpg,5
Birdsong: A Story in Pictures,birdsong-a-story-in-pictures_975/index.html,£54.64,../media/cache/af/6e/af6e796160fe63e0cf19d44395c7ddf2.jpg,3
America's Cradle of Quarterbacks: Western Pennsylvania's Football Factory from Johnny Unitas to Joe Montana,americas-cradle-of-quarterbacks-western-pennsylvanias-football-factory-from-johnny-unitas-to-joe-montana_974/index.html,£22.50,../media/cache/ef/0b/ef0bed08de4e083dba5e20fdb98d9c36.jpg,3
Aladdin and His Wonderful Lamp,aladdin-and-his-wonderful-lamp_973/index.html,£53.13,../media/cache/d6/da/d6da0371958068bbaf39ea9c174275cd.jpg,3
Worlds Elsewhere: Journeys Around Shakespeare’s Globe,worlds-elsewhere-journeys-around-shakespeares-globe_972/index.html,£40.30,../media/cache/2e/98/2e98c332bf8563b584784971541c4445.jpg,5
Wall and Piece,wall-and-piece_971/index.html,£44.18,../media/cache/a5/41/a5416b9646aaa7287baa287ec2590270.jpg,4
The Four Agreements: A Practical Guide to Personal Freedom,the-four-agreements-a-practical-guide-to-personal-freedom_970/index.html,£17.66,../media/cache/0f/7e/0f7ee69495c0df1d35723f012624a9f8.jpg,5
The Five Love Languages: How to Express Heartfelt Commitment to Your Mate,the-five-love-languages-how-to-express-heartfelt-commitment-to-your-mate_969/index.html,£31.05,../media/cache/38/c5/38c56fba316c07305643a8065269594e.jpg,3
The Elephant Tree,the-elephant-tree_968/index.html,£23.82,../media/cache/5d/7e/5d7ecde8e81513eba8a64c9fe000744b.jpg,5
The Bear and the Piano,the-bear-and-the-piano_967/index.html,£36.89,../media/cache/cf/bb/cfbb5e62715c6d888fd07794c9bab5d6.jpg,1
Sophie's World,sophies-world_966/index.html,£15.94,../media/cache/65/71/6571919836ec51ed54f0050c31d8a0cd.jpg,5
Penny Maybe,penny-maybe_965/index.html,£33.29,../media/cache/12/53/1253c21c5ef3c6d075c5fa3f5fecee6a.jpg,3
Maude (1883-1993):She Grew Up with the country,maude-1883-1993she-grew-up-with-the-country_964/index.html,£18.02,../media/cache/f5/88/f5889d038f5d8e949b494d147c2dcf54.jpg,2
"In a Dark, Dark Wood",in-a-dark-dark-wood_963/index.html,£19.63,../media/cache/23/85/238570a1c284e730dbc737a7e631ae2b.jpg,1
Behind Closed Doors,behind-closed-doors_962/index.html,£52.22,../media/cache/e1/5c/e15c289ba58cea38519e1281e859f0c1.jpg,4
You can't bury them all: Poems,you-cant-bury-them-all-poems_961/index.html,£33.63,../media/cache/e9/20/e9203b733126c4a0832a1c7885dc27cf.jpg,2
Slow States of Collapse: Poems,slow-states-of-collapse-poems_960/index.html,£57.31,../media/cache/72/41/72417db983862010ef0c1a25de98c7d7.jpg,3
Reasons to Stay Alive,reasons-to-stay-alive_959/index.html,£26.41,../media/cache/cb/bd/cbbdb0222ee8a0f6ab61657412a15794.jpg,2
Private Paris (Private #10),private-paris-private-10_958/index.html,£47.61,../media/cache/9d/05/9d0533bae1578846d728a82913b95c26.jpg,5
#HigherSelfie: Wake Up Your Life. Free Your Soul. Find Your Tribe.,higherselfie-wake-up-your-life-free-your-soul-find-your-tribe_957/index.html,£23.11,../media/cache/9c/46/9c463c7631c82401160fd3b554b8f0e1.jpg,5
Without Borders (Wanderlove #1),without-borders-wanderlove-1_956/index.html,£45.07,../media/cache/24/e2/24e2f5c9d325c4004d8190c054da86dd.jpg,2
When We Collided,when-we-collided_955/index.html,£31.77,../media/cache/08/04/08044269fc197645268a6197c57e6173.jpg,1
"We Love You, Charlie Freeman",we-love-you-charlie-freeman_954/index.html,£50.27,../media/cache/5f/15/5f152afdbc42356ecba02f61058a7e5b.jpg,5
Untitled Collection: Sabbath Poems 2014,untitled-collection-sabbath-poems-2014_953/index.html,£14.27,../media/cache/f9/3b/f93b4a650f03a5d21f2436d7813f42c2.jpg,4
"Unseen City: The Majesty of Pigeons, the Discreet Charm of Snails & Other Wonders of the Urban Wilderness",unseen-city-the-majesty-of-pigeons-the-discreet-charm-of-snails-other-wonders-of-the-urban-wilderness_952/index.html,£44.18,../media/cache/41/a2/41a20f35adf0caea24f208dc01ad7681.jpg,4
Unicorn Tracks,unicorn-tracks_951/index.html,£18.78,../media/cache/76/8e/768ea5924ac1ef6297c2be9959c796c2.jpg,3
"Unbound: How Eight Technologies Made Us Human, Transformed Society, and Brought Our World to the Brink",unbound-how-eight-technologies-made-us-human-transformed-society-and-brought-our-world-to-the-brink_950/index.html,£25.52,../media/cache/4a/3b/4a3b055f9e378a95fedbef55e7bab7ce.jpg,1
Tsubasa: WoRLD CHRoNiCLE 2 (Tsubasa WoRLD CHRoNiCLE #2),tsubasa-world-chronicle-2-tsubasa-world-chronicle-2_949/index.html,£16.28,../media/cache/36/df/36df4caaf1420b1183a8235355d39e69.jpg,1
Throwing Rocks at the Google Bus: How Growth Became the Enemy of Prosperity,throwing-rocks-at-the-google-bus-how-growth-became-the-enemy-of-prosperity_948/index.html,£31.12,../media/cache/03/86/038650c9e7517b4baf2a423cd8eed38f.jpg,3
This One Summer,this-one-summer_947/index.html,£19.49,../media/cache/c4/dd/c4ddd9ced89966b0602ec85e00cd5b61.jpg,4
Thirst,thirst_946/index.html,£17.27,../media/cache/c4/0a/c40a64f59e7487b1a80a049f6ceb2ba5.jpg,5
The Torch Is Passed: A Harding Family Story,the-torch-is-passed-a-harding-family-story_945/index.html,£19.09,../media/cache/33/e5/33e507172541628acfd421503196b578.jpg,1
The Secret of Dreadwillow Carse,the-secret-of-dreadwillow-carse_944/index.html,£56.13,../media/cache/c4/a2/c4a2a1a026c67bcceb5a411c724d7d0c.jpg,1
"The Pioneer Woman Cooks: Dinnertime: Comfort Classics, Freezer Food, 16-Minute Meals, and Other Delicious Ways to Solve Supper!",the-pioneer-woman-cooks-dinnertime-comfort-classics-freezer-food-16-minute-meals-and-other-delicious-ways-to-solve-supper_943/index.html,£56.41,../media/cache/b7/f4/b7f4843dbe062d44be1ffcfa16b2faa4.jpg,1
The Past Never Ends,the-past-never-ends_942/index.html,£56.50,../media/cache/89/b8/89b850edb01851a91f64ba114b96acb6.jpg,4
The Natural History of Us (The Fine Art of Pretending #2),the-natural-history-of-us-the-fine-art-of-pretending-2_941/index.html,£45.22,../media/cache/5d/7f/5d7f496cdf5e5962a73ecdcc1505c1d5.jpg,3
The Nameless City (The Nameless City #1),the-nameless-city-the-nameless-city-1_940/index.html,£38.16,../media/cache/f4/79/f479de5f305c2ac0512702cf7155bb74.jpg,4
The Murder That Never Was (Forensic Instincts #5),the-murder-that-never-was-forensic-instincts-5_939/index.html,£54.11,../media/cache/dc/44/dc44f8e2aebac48ca8553814d9b021a8.jpg,3
The Most Perfect Thing: Inside (and Outside) a Bird's Egg,the-most-perfect-thing-inside-and-outside-a-birds-egg_938/index.html,£42.96,../media/cache/d4/8d/d48d5122a15347e9fe2b15ad354d69bf.jpg,4
"The Mindfulness and Acceptance Workbook for Anxiety: A Guide to Breaking Free from Anxiety, Phobias, and Worry Using Acceptance and Commitment Therapy",the-mindfulness-and-acceptance-workbook-for-anxiety-a-guide-to-breaking-free-from-anxiety-phobias-and-worry-using-acceptance-and-commitment-therapy_937/index.html,£23.89,../media/cache/f8/6d/f86d08178e3788563ac17be5aefd29f0.jpg,4
The Life-Changing Magic of Tidying Up: The Japanese Art of Decluttering and Organizing,the-life-changing-magic-of-tidying-up-the-japanese-art-of-decluttering-and-organizing_936/index.html,£16.77,../media/cache/95/64/95647d6a526bf54120b9445e124794e1.jpg,3
"The Inefficiency Assassin: Time Management Tactics for Working Smarter, Not Longer",the-inefficiency-assassin-time-management-tactics-for-working-smarter-not-longer_935/index.html,£20.59,../media/cache/75/dc/75dce2f5949b407161f37f0af249b018.jpg,5
The Gutsy Girl: Escapades for Your Life of Epic Adventure,the-gutsy-girl-escapades-for-your-life-of-epic-adventure_934/index.html,£37.13,../media/cache/64/15/641570cd7e7aded53c7d33d78a9629f1.jpg,1
The Electric Pencil: Drawings from Inside State Hospital No. 3,the-electric-pencil-drawings-from-inside-state-hospital-no-3_933/index.html,£56.06,../media/cache/2e/23/2e236e23ad52aa74505f224f6552eda8.jpg,1
The Death of Humanity: and the Case for Life,the-death-of-humanity-and-the-case-for-life_932/index.html,£58.11,../media/cache/71/df/71df730cf38c232ee58a2e407135f055.jpg,4
"The Bulletproof Diet: Lose up to a Pound a Day, Reclaim Energy and Focus, Upgrade Your Life",the-bulletproof-diet-lose-up-to-a-pound-a-day-reclaim-energy-and-focus-upgrade-your-life_931/index.html,£49.05,../media/cache/ee/3e/ee3e219d23e73ba71c79b700f183aaed.jpg,3
The Art Forger,the-art-forger_930/index.html,£40.76,../media/cache/70/fa/70fa6c0437d9c97dbeada6bd32bf9d2c.jpg,3
The Age of Genius: The Seventeenth Century and the Birth of the Modern Mind,the-age-of-genius-the-seventeenth-century-and-the-birth-of-the-modern-mind_929/index.html,£19.73,../media/cache/2d/4e/2d4e358712e6c9f1d3bdd78d1a16e5a8.jpg,1
The Activist's Tao Te Ching: Ancient Advice for a Modern Revolution,the-activists-tao-te-ching-ancient-advice-for-a-modern-revolution_928/index.html,£32.24,../media/cache/96/db/96db61bb53930c560fb4c1c62b583816.jpg,5
Spark Joy: An Illustrated Master Class on the Art of Organizing and Tidying Up,spark-joy-an-illustrated-master-class-on-the-art-of-organizing-and-tidying-up_927/index.html,£41.83,../media/cache/f3/4f/f34ffb24cc21c9f9f52dad4fd8f3ac21.jpg,4
Soul Reader,soul-reader_926/index.html,£39.58,../media/cache/69/85/69852567cf97264a1442cbc882c84903.jpg,2
Security,security_925/index.html,£39.25,../media/cache/da/df/dadfac66a89774b46b10225362724c83.jpg,2
"Saga, Volume 6 (Saga (Collected Editions) #6)",saga-volume-6-saga-collected-editions-6_924/index.html,£25.02,../media/cache/43/ae/43aee83ebb31e2122a7215e413770e5c.jpg,3
"Saga, Volume 5 (Saga (Collected Editions) #5)",saga-volume-5-saga-collected-editions-5_923/index.html,£51.04,../media/cache/e1/ea/e1ea6cb36e62ae6dc7b805f68ab9a700.jpg,2
Reskilling America: Learning to Labor in the Twenty-First Century,reskilling-america-learning-to-labor-in-the-twenty-first-century_922/index.html,£19.83,../media/cache/97/f8/97f8debeeaaece9603267653076e760f.jpg,2
"Rat Queens, Vol. 3: Demons (Rat Queens (Collected Editions) #11-15)",rat-queens-vol-3-demons-rat-queens-collected-editions-11-15_921/index.html,£50.40,../media/cache/f3/ef/f3efd43ae0fa85d9b325d5e8783e7af5.jpg,3
"Princess Jellyfish 2-in-1 Omnibus, Vol. 01 (Princess Jellyfish 2-in-1 Omnibus #1)",princess-jellyfish-2-in-1-omnibus-vol-01-princess-jellyfish-2-in-1-omnibus-1_920/index.html,£13.61,../media/cache/78/0b/780b2c28122750c2c383846155815bf7.jpg,5
Princess Between Worlds (Wide-Awake Princess #5),princess-between-worlds-wide-awake-princess-5_919/index.html,£13.34,../media/cache/b7/e8/b7e84b78be3d9bb79b71156a5e5d4e42.jpg,5
"Pop Gun War, Volume 1: Gift",pop-gun-war-volume-1-gift_918/index.html,£18.97,../media/cache/c8/2f/c82f629a31b3f47bdb17ac14aa51076d.jpg,1
"Political Suicide: Missteps, Peccadilloes, Bad Calls, Backroom Hijinx, Sordid Pasts, Rotten Breaks, and Just Plain Dumb Mistakes in the Annals of American Politics",political-suicide-missteps-peccadilloes-bad-calls-backroom-hijinx-sordid-pasts-rotten-breaks-and-just-plain-dumb-mistakes-in-the-annals-of-american-politics_917/index.html,£36.28,../media/cache/64/44/6444dacdcb9edaadbbd691524622aeb8.jpg,2
Patience,patience_916/index.html,£10.16,../media/cache/01/72/01726c619a05114dca75bd840095016d.jpg,3
"Outcast, Vol. 1: A Darkness Surrounds Him (Outcast #1)",outcast-vol-1-a-darkness-surrounds-him-outcast-1_915/index.html,£15.44,../media/cache/cb/00/cb004189f548d75ad430d3ed19e6daa9.jpg,4
orange: The Complete Collection 1 (orange: The Complete Collection #1),orange-the-complete-collection-1-orange-the-complete-collection-1_914/index.html,£48.41,../media/cache/03/88/03886a8502ca54dbce0d91c2568ab69d.jpg,1
Online Marketing for Busy Authors: A Step-By-Step Guide,online-marketing-for-busy-authors-a-step-by-step-guide_913/index.html,£46.35,../media/cache/ea/9b/ea9b2cb8abbb317402e618445bade1e1.jpg,1
On a Midnight Clear,on-a-midnight-clear_912/index.html,£14.07,../media/cache/a1/14/a114d70e7babf110ba42a389078e9a45.jpg,3
Obsidian (Lux #1),obsidian-lux-1_911/index.html,£14.86,../media/cache/fc/72/fc72f158554b4b4164701e1dfa1153c7.jpg,2
My Paris Kitchen: Recipes and Stories,my-paris-kitchen-recipes-and-stories_910/index.html,£33.37,../media/cache/f5/65/f565af3d9dd20a1ad72a1e7c4157387d.jpg,2
Masks and Shadows,masks-and-shadows_909/index.html,£56.40,../media/cache/ff/e8/ffe81bf98f8386ef29e193abfb6f9c1e.jpg,2
"Mama Tried: Traditional Italian Cooking for the Screwed, Crude, Vegan, and Tattooed",mama-tried-traditional-italian-cooking-for-the-screwed-crude-vegan-and-tattooed_908/index.html,£14.02,../media/cache/10/c6/10c61093002db1fec4089d8076678624.jpg,4
"Lumberjanes, Vol. 2: Friendship to the Max (Lumberjanes #5-8)",lumberjanes-vol-2-friendship-to-the-max-lumberjanes-5-8_907/index.html,£46.91,../media/cache/d3/15/d3158e8d3546fb90cced3c1d44a92a34.jpg,2
"Lumberjanes, Vol. 1: Beware the Kitten Holy (Lumberjanes #1-4)",lumberjanes-vol-1-beware-the-kitten-holy-lumberjanes-1-4_906/index.html,£45.61,../media/cache/7e/a0/7ea062007ef00107e3c16d336b41fab2.jpg,3
Lumberjanes Vol. 3: A Terrible Plan (Lumberjanes #9-12),lumberjanes-vol-3-a-terrible-plan-lumberjanes-9-12_905/index.html,£19.92,../media/cache/5f/b1/5fb1bf88dcfda795606745ce35be5975.jpg,2
"Layered: Baking, Building, and Styling Spectacular Cakes",layered-baking-building-and-styling-spectacular-cakes_904/index.html,£40.11,../media/cache/98/d1/98d1c979c4bac9e147a6718946578b0f.jpg,1
Judo: Seven Steps to Black Belt (an Introductory Guide for Beginners),judo-seven-steps-to-black-belt-an-introductory-guide-for-beginners_903/index.html,£53.90,../media/cache/5f/52/5f52b1bc6d45daab2e330c744feb0359.jpg,2
Join,join_902/index.html,£35.67,../media/cache/93/63/9363f0065fbad5689f44fcf6e203eef3.jpg,5
In the Country We Love: My Family Divided,in-the-country-we-love-my-family-divided_901/index.html,£22.00,../media/cache/fe/ea/feeafd2ad7b3077f8e74cbb1da9e3c7d.jpg,4
Immunity: How Elie Metchnikoff Changed the Course of Modern Medicine,immunity-how-elie-metchnikoff-changed-the-course-of-modern-medicine_900/index.html,£57.36,../media/cache/26/1c/261c4eaf957ae4aacf2229b482e76dbe.jpg,5
"I Hate Fairyland, Vol. 1: Madly Ever After (I Hate Fairyland (Compilations) #1-5)",i-hate-fairyland-vol-1-madly-ever-after-i-hate-fairyland-compilations-1-5_899/index.html,£29.17,../media/cache/aa/74/aa74004807e97a79aa084b5db329a99b.jpg,2
I am a Hero Omnibus Volume 1,i-am-a-hero-omnibus-volume-1_898/index.html,£54.63,../media/cache/16/d4/16d443437126bf6d536a89312c1995a5.jpg,3
How to Be Miserable: 40 Strategies You Already Use,how-to-be-miserable-40-strategies-you-already-use_897/index.html,£46.03,../media/cache/da/8b/da8bc9b824dd3f446ef63e438ddbfc85.jpg,1
Her Backup Boyfriend (The Sorensen Family #1),her-backup-boyfriend-the-sorensen-family-1_896/index.html,£33.97,../media/cache/1e/bb/1ebbbc3e2d3249b111033cfc40763b0b.jpg,1
"Giant Days, Vol. 2 (Giant Days #5-8)",giant-days-vol-2-giant-days-5-8_895/index.html,£22.11,../media/cache/90/6f/906f0168b0e155a7077625499b1737b5.jpg,2
Forever and Forever: The Courtship of Henry Longfellow and Fanny Appleton,forever-and-forever-the-courtship-of-henry-longfellow-and-fanny-appleton_894/index.html,£29.69,../media/cache/d6/58/d658a1485b130ff26ca5fb0d5975ed2e.jpg,3
First and First (Five Boroughs #3),first-and-first-five-boroughs-3_893/index.html,£15.97,../media/cache/c4/d1/c4d1517cc9370e292366b6132ca9ca36.jpg,4
Fifty Shades Darker (Fifty Shades #2),fifty-shades-darker-fifty-shades-2_892/index.html,£21.96,../media/cache/cc/bd/ccbdae9e29b3594301528fa2c876ec29.jpg,1
Everydata: The Misinformation Hidden in the Little Data You Consume Every Day,everydata-the-misinformation-hidden-in-the-little-data-you-consume-every-day_891/index.html,£54.35,../media/cache/64/94/6494bf61176ca73b61255909230030be.jpg,2
"Don't Be a Jerk: And Other Practical Advice from Dogen, Japan's Greatest Zen Master",dont-be-a-jerk-and-other-practical-advice-from-dogen-japans-greatest-zen-master_890/index.html,£37.97,../media/cache/95/30/953013d044aa313cc162dec414f3969a.jpg,2
Danganronpa Volume 1,danganronpa-volume-1_889/index.html,£51.99,../media/cache/78/97/7897eea91c4a85aca58d925861d4afec.jpg,4
Crown of Midnight (Throne of Glass #2),crown-of-midnight-throne-of-glass-2_888/index.html,£43.29,../media/cache/66/25/6625e3bbb050de3e42a0c302c0d69f1f.jpg,3
"Codename Baboushka, Volume 1: The Conclave of Death",codename-baboushka-volume-1-the-conclave-of-death_887/index.html,£36.72,../media/cache/f6/88/f688a9d6a89fdf38e4e88439ee9eda69.jpg,4
Camp Midnight,camp-midnight_886/index.html,£17.08,../media/cache/dd/c9/ddc95df6754df8e71bf969c088056188.jpg,4
Call the Nurse: True Stories of a Country Nurse on a Scottish Isle,call-the-nurse-true-stories-of-a-country-nurse-on-a-scottish-isle_885/index.html,£29.14,../media/cache/88/9e/889e0bac4c7c0e7178f0165b8d3b4617.jpg,5
Burning,burning_884/index.html,£28.81,../media/cache/26/95/269507c7bb35d2cec9b61a03d1c28e67.jpg,3
Bossypants,bossypants_883/index.html,£49.46,../media/cache/27/d2/27d20361745ec2f7be668b18a4da29da.jpg,2
"Bitch Planet, Vol. 1: Extraordinary Machine (Bitch Planet (Collected Editions))",bitch-planet-vol-1-extraordinary-machine-bitch-planet-collected-editions_882/index.html,£37.92,../media/cache/e4/1d/e41d34204a1fffbf825d8beb3dbf4cbc.jpg,2
"Avatar: The Last Airbender: Smoke and Shadow, Part 3 (Smoke and Shadow #3)",avatar-the-last-airbender-smoke-and-shadow-part-3-smoke-and-shadow-3_881/index.html,£28.09,../media/cache/06/18/061811c5845d0e13bc04b2a755f0830f.jpg,2
Algorithms to Live By: The Computer Science of Human Decisions,algorithms-to-live-by-the-computer-science-of-human-decisions_880/index.html,£30.81,../media/cache/23/b4/23b42e094c02d52b14b11a960d49610e.jpg,1
A World of Flavor: Your Gluten Free Passport,a-world-of-flavor-your-gluten-free-passport_879/index.html,£42.95,../media/cache/78/2e/782e315667ec50759b8603527ee33dec.jpg,1
"A Piece of Sky, a Grain of Rice: A Memoir in Four Meditations",a-piece-of-sky-a-grain-of-rice-a-memoir-in-four-meditations_878/index.html,£56.76,../media/cache/08/89/088995e862aac86c88c608d763f6390e.jpg,5
A Murder in Time,a-murder-in-time_877/index.html,£16.64,../media/cache/11/aa/11aaad48b5f15e262456ca65294084da.jpg,1
A Flight of Arrows (The Pathfinders #2),a-flight-of-arrows-the-pathfinders-2_876/index.html,£55.53,../media/cache/82/96/8296f92b70fb1dafefecda92c1d51941.jpg,5
A Fierce and Subtle Poison,a-fierce-and-subtle-poison_875/index.html,£28.13,../media/cache/12/f1/12f1963957f27fa83d51f76b183ef490.jpg,4
A Court of Thorns and Roses (A Court of Thorns and Roses #1),a-court-of-thorns-and-roses-a-court-of-thorns-and-roses-1_874/index.html,£52.37,../media/cache/c0/88/c08816960890396213a423941af65b8f.jpg,1
(Un)Qualified: How God Uses Broken People to Do Big Things,unqualified-how-god-uses-broken-people-to-do-big-things_873/index.html,£54.00,../media/cache/cd/db/cddb3eb483ef11a088d519205b7098fb.jpg,5
You Are What You Love: The Spiritual Power of Habit,you-are-what-you-love-the-spiritual-power-of-habit_872/index.html,£21.87,../media/cache/6b/70/6b70f2cdb17d9ab7551240a88b9211fe.jpg,4
"William Shakespeare's Star Wars: Verily, A New Hope (William Shakespeare's Star Wars #4)",william-shakespeares-star-wars-verily-a-new-hope-william-shakespeares-star-wars-4_871/index.html,£43.30,../media/cache/02/37/0237b445efc18c5562355a5a2c40889c.jpg,4
Tuesday Nights in 1980,tuesday-nights-in-1980_870/index.html,£21.04,../media/cache/6b/da/6bdae061cb92c32b0b83cda8dd10275d.jpg,2
Tracing Numbers on a Train,tracing-numbers-on-a-train_869/index.html,£41.60,../media/cache/06/a6/06a6cfcf89afd1601cbba1a16cda57fb.jpg,3
Throne of Glass (Throne of Glass #1),throne-of-glass-throne-of-glass-1_868/index.html,£35.07,../media/cache/32/d6/32d6aa560e8ddf2a4da1526b95d4c7ab.jpg,3
Thomas Jefferson and the Tripoli Pirates: The Forgotten War That Changed American History,thomas-jefferson-and-the-tripoli-pirates-the-forgotten-war-that-changed-american-history_867/index.html,£59.64,../media/cache/97/47/974709d437b08e74649b5744471bf472.jpg,1
Thirteen Reasons Why,thirteen-reasons-why_866/index.html,£52.72,../media/cache/8a/83/8a83b6ce350f01bab21f85e6ba539316.jpg,1
The White Cat and the Monk: A Retelling of the Poem “Pangur Bán”,the-white-cat-and-the-monk-a-retelling-of-the-poem-pangur-ban_865/index.html,£58.08,../media/cache/26/32/2632a1e12f2c085fabbe022ae4cd6933.jpg,4
The Wedding Dress,the-wedding-dress_864/index.html,£24.12,../media/cache/28/99/28992d89f4abf54fba183fc8d074adf3.jpg,1
The Vacationers,the-vacationers_863/index.html,£42.15,../media/cache/37/25/372578cc073efae80cf284b56040a488.jpg,4
The Third Wave: An Entrepreneur’s Vision of the Future,the-third-wave-an-entrepreneurs-vision-of-the-future_862/index.html,£12.61,../media/cache/d0/77/d077a30042df6b916bfc8d257345c69e.jpg,5
The Stranger,the-stranger_861/index.html,£17.44,../media/cache/ea/04/ea0476a6f4c318ceccf5e2f2b39f2b15.jpg,4
The Shadow Hero (The Shadow Hero),the-shadow-hero-the-shadow-hero_860/index.html,£33.14,../media/cache/1f/62/1f621dda1b302fc16d83d94b0b5ac31c.jpg,1
The Secret (The Secret #1),the-secret-the-secret-1_859/index.html,£27.37,../media/cache/4e/0f/4e0f05ae01d8fb6bd0d3901edd06de16.jpg,4
The Regional Office Is Under Attack!,the-regional-office-is-under-attack_858/index.html,£51.36,../media/cache/f8/31/f8314c7fdaa79fb7191a583e9a852db8.jpg,5
The Psychopath Test: A Journey Through the Madness Industry,the-psychopath-test-a-journey-through-the-madness-industry_857/index.html,£36.00,../media/cache/34/f5/34f5f8e513c5f048241f5695e61b2483.jpg,2
The Project,the-project_856/index.html,£10.65,../media/cache/10/6e/106e2fc7160712edf8e2ff996dc8cd6c.jpg,1
The Power of Now: A Guide to Spiritual Enlightenment,the-power-of-now-a-guide-to-spiritual-enlightenment_855/index.html,£43.54,../media/cache/03/38/0338682e76bad3216cd4c6c28b2b625a.jpg,2
The Omnivore's Dilemma: A Natural History of Four Meals,the-omnivores-dilemma-a-natural-history-of-four-meals_854/index.html,£38.21,../media/cache/14/f3/14f3d525e2a114cd71e27201a16af188.jpg,2
