title,link,price,thumbnail,rating
My Life Next Door (My Life Next Door ),my-life-next-door-my-life-next-door_535/index.html,£36.39,../media/cache/98/00/98001a78a78ab77027145ff586d64431.jpg,5
Miller's Valley,millers-valley_534/index.html,£58.54,../media/cache/dc/1a/dc1a54201eff16a11e7d84eef5ea36c7.jpg,2
Man's Search for Meaning,mans-search-for-meaning_533/index.html,£29.48,../media/cache/ed/ff/edffa2eec8d96b8ddcd53d5c2eff8453.jpg,3
"Love That Boy: What Two Presidents, Eight Road Trips, and My Son Taught Me About a Parent's Expectations",love-that-boy-what-two-presidents-eight-road-trips-and-my-son-taught-me-about-a-parents-expectations_532/index.html,£25.06,../media/cache/6d/1b/6d1b236549b8d5bc9e20786a25b7e7d1.jpg,2
Living Forward: A Proven Plan to Stop Drifting and Get the Life You Want,living-forward-a-proven-plan-to-stop-drifting-and-get-the-life-you-want_531/index.html,£12.55,../media/cache/c9/76/c9767187068d80827d0967225ce3925d.jpg,3
Les Fleurs du Mal,les-fleurs-du-mal_530/index.html,£29.04,../media/cache/36/5b/365b3ab7ab72a6258873716aef6d5c1a.jpg,5
Left Behind (Left Behind #1),left-behind-left-behind-1_529/index.html,£40.72,../media/cache/d7/e2/d7e27f418884548ee1b551c67bcd222c.jpg,2
Kill 'Em and Leave: Searching for James Brown and the American Soul,kill-em-and-leave-searching-for-james-brown-and-the-american-soul_528/index.html,£45.05,../media/cache/85/42/8542841f5644a6daf433504f1e106e97.jpg,5
Kierkegaard: A Christian Missionary to Christians,kierkegaard-a-christian-missionary-to-christians_527/index.html,£47.13,../media/cache/05/ce/05ce699eaf78c0fae20308497c4f496a.jpg,1
John Vassos: Industrial Design for Modern Life,john-vassos-industrial-design-for-modern-life_526/index.html,£20.22,../media/cache/85/a1/85a19d4c20a4801013e8108a166d10af.jpg,4
I'll Give You the Sun,ill-give-you-the-sun_525/index.html,£56.48,../media/cache/af/93/af933f86038dc55487b5bf1d81ff4bfb.jpg,1
I Will Find You,i-will-find-you_524/index.html,£44.21,../media/cache/87/28/8728f8880e95b848021f6a9b3dcd07ca.jpg,1
Hystopia: A Novel,hystopia-a-novel_523/index.html,£21.96,../media/cache/2d/7b/2d7b77d8b45b2f8e1bc0ce20aacddad0.jpg,4
Howl and Other Poems,howl-and-other-poems_522/index.html,£40.45,../media/cache/b7/29/b7293f602efb0c17e305077f8175888a.jpg,2
History of Beauty,history-of-beauty_521/index.html,£10.29,../media/cache/58/a6/58a634c3231b5380544cc330536cb5ea.jpg,4
Heaven is for Real: A Little Boy's Astounding Story of His Trip to Heaven and Back,heaven-is-for-real-a-little-boys-astounding-story-of-his-trip-to-heaven-and-back_520/index.html,£52.86,../media/cache/58/6a/586afa8809f59bff51b89b2bc4a16129.jpg,2
Future Shock (Future Shock #1),future-shock-future-shock-1_519/index.html,£55.65,../media/cache/89/10/8910c36eec96636288a9cfb61610c9fa.jpg,5
Ender's Game (The Ender Quintet #1),enders-game-the-ender-quintet-1_518/index.html,£43.64,../media/cache/8a/0d/8a0d251ccece436f956df676c99e70f7.jpg,1
Diary of a Citizen Scientist: Chasing Tiger Beetles and Other New Ways of Engaging the World,diary-of-a-citizen-scientist-chasing-tiger-beetles-and-other-new-ways-of-engaging-the-world_517/index.html,£28.41,../media/cache/33/4f/334fd0ebdf0c0192baf5914d199c53b5.jpg,1
Death by Leisure: A Cautionary Tale,death-by-leisure-a-cautionary-tale_516/index.html,£37.51,../media/cache/7d/16/7d16c126f85826628bf9dcccd7a66b32.jpg,4
Brilliant Beacons: A History of the American Lighthouse,brilliant-beacons-a-history-of-the-american-lighthouse_515/index.html,£11.45,../media/cache/56/cb/56cb66d73fb438d64af14dce8bd8b22b.jpg,3
Brazen: The Courage to Find the You That's Been Hiding,brazen-the-courage-to-find-the-you-thats-been-hiding_514/index.html,£19.22,../media/cache/3a/4f/3a4fb30cfc5742f4726bc9f807b66cda.jpg,2
Between the World and Me,between-the-world-and-me_513/index.html,£56.91,../media/cache/73/45/7345c412c4c821f131d3c159e027c3a0.jpg,4
Being Mortal: Medicine and What Matters in the End,being-mortal-medicine-and-what-matters-in-the-end_512/index.html,£55.06,../media/cache/c7/7f/c77fdad22e40b8b923ec6c5b1f5a740f.jpg,4
"A Murder Over a Girl: Justice, Gender, Junior High",a-murder-over-a-girl-justice-gender-junior-high_511/index.html,£13.20,../media/cache/56/31/56313728d302c83f2a8c70fba635ce33.jpg,3
32 Yolks,32-yolks_510/index.html,£53.63,../media/cache/1d/1f/1d1fbd89f0290275b9166877663ee9f5.jpg,2
"""Most Blessed of the Patriarchs"": Thomas Jefferson and the Empire of the Imagination",most-blessed-of-the-patriarchs-thomas-jefferson-and-the-empire-of-the-imagination_509/index.html,£44.48,../media/cache/11/af/11af7fbd6aec06a75fe207fae92b17e0.jpg,5
You Are a Badass: How to Stop Doubting Your Greatness and Start Living an Awesome Life,you-are-a-badass-how-to-stop-doubting-your-greatness-and-start-living-an-awesome-life_508/index.html,£12.08,../media/cache/9e/15/9e15d7add5090ff2a17bd71ac96aa55a.jpg,3
Wildlife of New York: A Five-Borough Coloring Book,wildlife-of-new-york-a-five-borough-coloring-book_507/index.html,£22.14,../media/cache/0c/07/0c07b114195b45c156f7f1e23820c49a.jpg,2
What Happened on Beale Street (Secrets of the South Mysteries #2),what-happened-on-beale-street-secrets-of-the-south-mysteries-2_506/index.html,£25.37,../media/cache/c7/ab/c7abb5e32bd37118a87523dcee0a70a6.jpg,5
Unreasonable Hope: Finding Faith in the God Who Brings Purpose to Your Pain,unreasonable-hope-finding-faith-in-the-god-who-brings-purpose-to-your-pain_505/index.html,£46.33,../media/cache/8b/10/8b102daec94d1ea9c6fc36dd3ec1c1fe.jpg,2
Under the Tuscan Sun,under-the-tuscan-sun_504/index.html,£37.33,../media/cache/98/c2/98c2e95c5fd1a4e7cd5f2b63c52826cb.jpg,3
Toddlers Are A**holes: It's Not Your Fault,toddlers-are-aholes-its-not-your-fault_503/index.html,£25.55,../media/cache/4c/30/4c3041def6f29659e009f61e45e492b0.jpg,1
The Year of Living Biblically: One Man's Humble Quest to Follow the Bible as Literally as Possible,the-year-of-living-biblically-one-mans-humble-quest-to-follow-the-bible-as-literally-as-possible_502/index.html,£34.72,../media/cache/8e/43/8e4335b369bdad5ccc1551e5592f89ac.jpg,1
The Whale,the-whale_501/index.html,£35.96,../media/cache/6c/18/6c18ea03e294bfcfe07cf531c6c5f5b3.jpg,4
The Story of Art,the-story-of-art_500/index.html,£41.14,../media/cache/bb/36/bb364a10868756d1c0877c928b43b533.jpg,4
The Origin of Species,the-origin-of-species_499/index.html,£10.01,../media/cache/da/0d/da0d13699a090516502257a4d7da623f.jpg,4
The Great Gatsby,the-great-gatsby_498/index.html,£36.05,../media/cache/28/cb/28cb7a5e23c1339a0d6aafd5e7e190d6.jpg,4
The Good Girl,the-good-girl_497/index.html,£49.03,../media/cache/e2/71/e2718be90a081b33d2606a386b073998.jpg,3
The Glass Castle,the-glass-castle_496/index.html,£16.24,../media/cache/e0/e9/e0e97d416322d9728df7d9e589d6a998.jpg,1
The Faith of Christopher Hitchens: The Restless Soul of the World's Most Notorious Atheist,the-faith-of-christopher-hitchens-the-restless-soul-of-the-worlds-most-notorious-atheist_495/index.html,£39.55,../media/cache/cc/a4/cca4e6a4cd5c207e7ce7d992ff464c3b.jpg,1
The Drowning Girls,the-drowning-girls_494/index.html,£35.67,../media/cache/f5/d9/f5d90537f3bed5ad7c8971190beb0730.jpg,3
The Constant Princess (The Tudor Court #1),the-constant-princess-the-tudor-court-1_493/index.html,£16.62,../media/cache/fc/80/fc80b999ff4b8ef24b7071f62d2bf6d1.jpg,3
The Bourne Identity (Jason Bourne #1),the-bourne-identity-jason-bourne-1_492/index.html,£42.78,../media/cache/40/8d/408d93b27ce8c9cfb3bf66c17e9a54ab.jpg,4
The Bachelor Girl's Guide to Murder (Herringford and Watts Mysteries #1),the-bachelor-girls-guide-to-murder-herringford-and-watts-mysteries-1_491/index.html,£52.30,../media/cache/95/d7/95d7541679fcbd579b8a4f2b47231aaf.jpg,5
The Art Book,the-art-book_490/index.html,£32.34,../media/cache/99/51/99511f4da1a4a2114e2ed12e6ba17b65.jpg,2
The 7 Habits of Highly Effective People: Powerful Lessons in Personal Change,the-7-habits-of-highly-effective-people-powerful-lessons-in-personal-change_489/index.html,£33.17,../media/cache/c9/c3/c9c3d568ff6ddb98bde01c9d0b1d920a.jpg,4
Team of Rivals: The Political Genius of Abraham Lincoln,team-of-rivals-the-political-genius-of-abraham-lincoln_488/index.html,£20.12,../media/cache/56/75/567575381760b5c1ec018d10d350fc5f.jpg,5
Steal Like an Artist: 10 Things Nobody Told You About Being Creative,steal-like-an-artist-10-things-nobody-told-you-about-being-creative_487/index.html,£20.90,../media/cache/5f/17/5f17f0e06d7d67717eff3833d309a233.jpg,2
"Sit, Stay, Love",sit-stay-love_486/index.html,£20.90,../media/cache/8e/40/8e408552c2e7ee81cd60c03c79f604af.jpg,3
Sister Dear,sister-dear_485/index.html,£40.20,../media/cache/fa/57/fa570b7a0fb42252f61e1e750c79d417.jpg,4
"Shrunken Treasures: Literary Classics, Short, Sweet, and Silly",shrunken-treasures-literary-classics-short-sweet-and-silly_484/index.html,£52.87,../media/cache/4f/1e/4f1ece2500f8dbacecca42d57befca03.jpg,3
"Rich Dad, Poor Dad",rich-dad-poor-dad_483/index.html,£51.74,../media/cache/18/f4/18f45d31e3892fee589e23f15d759ee3.jpg,1
Raymie Nightingale,raymie-nightingale_482/index.html,£34.41,../media/cache/8f/66/8f66ec46e671d6fca79649c10c7c8f8a.jpg,2
Playing from the Heart,playing-from-the-heart_481/index.html,£32.38,../media/cache/1c/eb/1cebdf525ebe970a1dc3c5a8c50eae6b.jpg,1
Nightstruck: A Novel,nightstruck-a-novel_480/index.html,£50.35,../media/cache/c0/df/c0dfd5388bb38b9c24da2e94534e1198.jpg,4
"Naturally Lean: 125 Nourishing Gluten-Free, Plant-Based Recipes--All Under 300 Calories",naturally-lean-125-nourishing-gluten-free-plant-based-recipes-all-under-300-calories_479/index.html,£11.38,../media/cache/e6/b6/e6b66353f9325518994dd8b564290fd7.jpg,5
Meternity,meternity_478/index.html,£43.58,../media/cache/39/e3/39e33ebef2d7a35dd6899541eba8306d.jpg,3
Memoirs of a Geisha,memoirs-of-a-geisha_477/index.html,£49.67,../media/cache/41/80/4180406c788ff3e0f37cd4491a260a5b.jpg,3
Like Never Before (Walker Family #2),like-never-before-walker-family-2_476/index.html,£28.77,../media/cache/17/e2/17e264d978942f73b859fa1c1d2cf827.jpg,2
Life of Pi,life-of-pi_475/index.html,£13.22,../media/cache/e7/ae/e7aee104ca78dac961bd906294fe88f1.jpg,4
Leave This Song Behind: Teen Poetry at Its Best,leave-this-song-behind-teen-poetry-at-its-best_474/index.html,£51.17,../media/cache/31/c7/31c7c5ce7b04d227aa36ecb250b9dad5.jpg,5
King's Folly (The Kinsman Chronicles #1),kings-folly-the-kinsman-chronicles-1_473/index.html,£39.61,../media/cache/3e/2d/3e2d526ee062008ab1cbf54f90a5abb2.jpg,5
John Adams,john-adams_472/index.html,£57.43,../media/cache/59/b4/59b4f94b4dc4c7cb844a6f24a5e2a41e.jpg,4
How to Cook Everything Vegetarian: Simple Meatless Recipes for Great Food (How to Cook Everything),how-to-cook-everything-vegetarian-simple-meatless-recipes-for-great-food-how-to-cook-everything_471/index.html,£46.01,../media/cache/59/2d/592dc2dee11b798780f5ae613b970a34.jpg,4
How to Be a Domestic Goddess: Baking and the Art of Comfort Cooking,how-to-be-a-domestic-goddess-baking-and-the-art-of-comfort-cooking_470/index.html,£28.25,../media/cache/e2/5c/e25cbc27ebc12e47cdf3f7adc87cccdc.jpg,2
Good in Bed (Cannie Shapiro #1),good-in-bed-cannie-shapiro-1_469/index.html,£37.05,../media/cache/1d/f4/1df443b1bd6d7a1d804b4780a666438f.jpg,5
"Fruits Basket, Vol. 7 (Fruits Basket #7)",fruits-basket-vol-7-fruits-basket-7_468/index.html,£19.57,../media/cache/b4/36/b43672509477baa090e57ebeacbb28fb.jpg,1
For the Love: Fighting for Grace in a World of Impossible Standards,for-the-love-fighting-for-grace-in-a-world-of-impossible-standards_467/index.html,£45.13,../media/cache/a7/d8/a7d8fda2a874567aab8f61b2b141a5e2.jpg,3
Finding God in the Ruins: How God Redeems Pain,finding-god-in-the-ruins-how-god-redeems-pain_466/index.html,£46.64,../media/cache/ae/2c/ae2ce9662ed6da3de501ff87551ccb2d.jpg,2
Every Heart a Doorway (Every Heart A Doorway #1),every-heart-a-doorway-every-heart-a-doorway-1_465/index.html,£12.16,../media/cache/50/d4/50d41a24990208deb72c9802a6c1e540.jpg,5
Delivering the Truth (Quaker Midwife Mystery #1),delivering-the-truth-quaker-midwife-mystery-1_464/index.html,£20.89,../media/cache/57/31/5731a5d46c2c1e88977eb5e6d1337a2e.jpg,4
Counted With the Stars (Out from Egypt #1),counted-with-the-stars-out-from-egypt-1_463/index.html,£17.97,../media/cache/32/2c/322c1f6cce6d5a69a7d2321779195a0c.jpg,5
"Chronicles, Vol. 1",chronicles-vol-1_462/index.html,£52.60,../media/cache/11/fc/11fc94453c4dc0d68543971d7843afb0.jpg,2
Blue Like Jazz: Nonreligious Thoughts on Christian Spirituality,blue-like-jazz-nonreligious-thoughts-on-christian-spirituality_461/index.html,£25.77,../media/cache/a2/f5/a2f5b5fd4421d56d37c73a7fb29f5f40.jpg,1
Benjamin Franklin: An American Life,benjamin-franklin-an-american-life_460/index.html,£48.19,../media/cache/25/f8/25f869fa75340fca0fc2a68e8a0412a1.jpg,3
"At The Existentialist Café: Freedom, Being, and apricot cocktails with: Jean-Paul Sartre, Simone de Beauvoir, Albert Camus, Martin Heidegger, Edmund Husserl, Karl Jaspers, Maurice Merleau-Ponty and others",at-the-existentialist-cafe-freedom-being-and-apricot-cocktails-with-jean-paul-sartre-simone-de-beauvoir-albert-camus-martin-heidegger-edmund-husserl-karl-jaspers-maurice-merleau-ponty-and-others_459/index.html,£29.93,../media/cache/de/76/de76d5c473c358bd41c03cf710692bfb.jpg,5
A Summer In Europe,a-summer-in-europe_458/index.html,£44.34,../media/cache/4e/15/4e15150388702ebca2c5a523ac270539.jpg,2
A Short History of Nearly Everything,a-short-history-of-nearly-everything_457/index.html,£52.40,../media/cache/3c/f6/3cf646523ff7fb8647c500d6325cfcaf.jpg,5
A Gathering of Shadows (Shades of Magic #2),a-gathering-of-shadows-shades-of-magic-2_456/index.html,£44.81,../media/cache/48/b2/48b20fcc9ab722729de2c4da3d4de26e.jpg,4
The Sound Of Love,the-sound-of-love_455/index.html,£57.84,../media/cache/4e/3a/4e3a151bbe2629a55df09fd318fdeb0a.jpg,5
The Rise and Fall of the Third Reich: A History of Nazi Germany,the-rise-and-fall-of-the-third-reich-a-history-of-nazi-germany_454/index.html,£39.67,../media/cache/e1/02/e102cefae5bb523bc67eb6b49bc18b5d.jpg,2
The Perks of Being a Wallflower,the-perks-of-being-a-wallflower_453/index.html,£55.02,../media/cache/ca/5b/ca5b33c09daab4667ed37b330de889bd.jpg,3
The Mysterious Affair at Styles (Hercule Poirot #1),the-mysterious-affair-at-styles-hercule-poirot-1_452/index.html,£24.80,../media/cache/32/94/3294e5eaf73a37958583483fc9a90f04.jpg,4
The Man Who Mistook His Wife for a Hat and Other Clinical Tales,the-man-who-mistook-his-wife-for-a-hat-and-other-clinical-tales_451/index.html,£59.45,../media/cache/92/fe/92fe1c1823653412fe68be2c525dfc3a.jpg,4
The Makings of a Fatherless Child,the-makings-of-a-fatherless-child_450/index.html,£31.58,../media/cache/6f/6c/6f6c7560e254f8242f86ef048f1ba7b3.jpg,2
The Joy of Cooking,the-joy-of-cooking_449/index.html,£43.27,../media/cache/05/8e/058ebff59d12ebe40df1844bedd9366b.jpg,4
The Invention of Wings,the-invention-of-wings_448/index.html,£37.34,../media/cache/62/fa/62fa1e72f06f05762db5d9cedf654153.jpg,1
The Hobbit (Middle-Earth Universe),the-hobbit-middle-earth-universe_447/index.html,£17.80,../media/cache/8b/d3/8bd38de5367fc675467431f343862569.jpg,5
The Great Railway Bazaar,the-great-railway-bazaar_446/index.html,£30.54,../media/cache/76/de/76de41867f323d7f1f4fbe2fdfc1b2ba.jpg,1
The Golden Compass (His Dark Materials #1),the-golden-compass-his-dark-materials-1_445/index.html,£18.77,../media/cache/e7/9f/e79f81bfea1cb8b0503db022b64da713.jpg,1
The God Delusion,the-god-delusion_444/index.html,£46.85,../media/cache/36/64/36643d44134c8a227988927013805e61.jpg,3
The Girl You Left Behind (The Girl You Left Behind #1),the-girl-you-left-behind-the-girl-you-left-behind-1_443/index.html,£15.79,../media/cache/d0/b6/d0b6d59c0662dcbd15d47add40af1ebd.jpg,1
The Fellowship of the Ring (The Lord of the Rings #1),the-fellowship-of-the-ring-the-lord-of-the-rings-1_442/index.html,£10.27,../media/cache/ed/75/ed75000b92734d99b76a17954857327c.jpg,2
The Collected Poems of W.B. Yeats (The Collected Works of W.B. Yeats #1),the-collected-poems-of-wb-yeats-the-collected-works-of-wb-yeats-1_441/index.html,£15.42,../media/cache/7e/93/7e934132cd03486649fb492fe702f704.jpg,5
The Barefoot Contessa Cookbook,the-barefoot-contessa-cookbook_440/index.html,£59.92,../media/cache/dd/07/dd07bd0c443756b9dc260813c1949b4f.jpg,5
Tell the Wolves I'm Home,tell-the-wolves-im-home_439/index.html,£50.96,../media/cache/f9/72/f972e744117c9d4b5fefb3410c0e9f7c.jpg,2
Ship Leaves Harbor: Essays on Travel by a Recovering Journeyman,ship-leaves-harbor-essays-on-travel-by-a-recovering-journeyman_438/index.html,£30.60,../media/cache/31/b0/31b0e0a42826b326e43235beb8ddd783.jpg,3
Pride and Prejudice,pride-and-prejudice_437/index.html,£19.27,../media/cache/c8/09/c80991f861675b6e75dc7f2f6a50e5a0.jpg,4
Musicophilia: Tales of Music and the Brain,musicophilia-tales-of-music-and-the-brain_436/index.html,£46.58,../media/cache/02/66/02667c5b8f5a5e9e45c0799518f086ca.jpg,1
Mere Christianity,mere-christianity_435/index.html,£48.51,../media/cache/d2/90/d29093abd0b9d5258e2e08b731778158.jpg,3
Me Before You (Me Before You #1),me-before-you-me-before-you-1_434/index.html,£19.02,../media/cache/a2/cd/a2cd0016b37c0407059147e58e14afe5.jpg,1
In the Woods (Dublin Murder Squad #1),in-the-woods-dublin-murder-squad-1_433/index.html,£38.38,../media/cache/24/a1/24a175dac7cb91ff26e2d723cdc6e098.jpg,2
In Cold Blood,in-cold-blood_432/index.html,£49.98,../media/cache/eb/4e/eb4ea9c04dccab509451ba31feb6b4e8.jpg,4
How to Stop Worrying and Start Living,how-to-stop-worrying-and-start-living_431/index.html,£46.49,../media/cache/4f/08/4f08f7948770912e4e340e10caa604cb.jpg,5
Give It Back,give-it-back_430/index.html,£18.32,../media/cache/8b/7c/8b7c73e075cc687b6890dc0dca9fcbcc.jpg,2
"Girl, Interrupted",girl-interrupted_429/index.html,£42.14,../media/cache/f9/ec/f9ec97bd8b29cc4e36d6c2b093d04709.jpg,3
Fun Home: A Family Tragicomic,fun-home-a-family-tragicomic_428/index.html,£56.59,../media/cache/54/ae/54ae8233e8422676c241d1cea0b67f1d.jpg,4
"Fruits Basket, Vol. 6 (Fruits Basket #6)",fruits-basket-vol-6-fruits-basket-6_427/index.html,£20.96,../media/cache/94/1a/941a14dec32f0a949c38a325a715c138.jpg,4
Deception Point,deception-point_426/index.html,£40.32,../media/cache/fa/2d/fa2d3198b7ba9785e0edd6f41b84d72b.jpg,4
"Death Note, Vol. 6: Give-and-Take (Death Note #6)",death-note-vol-6-give-and-take-death-note-6_425/index.html,£36.39,../media/cache/07/5c/075c210f5ce43b84d29646a54529d1bd.jpg,3
Catherine the Great: Portrait of a Woman,catherine-the-great-portrait-of-a-woman_424/index.html,£58.55,../media/cache/72/f1/72f13b8f069d3a018d2c378be5a1de20.jpg,4
Better Homes and Gardens New Cook Book,better-homes-and-gardens-new-cook-book_423/index.html,£39.61,../media/cache/75/82/7582e20b84f603358a8d55cd6a0a50f4.jpg,3
An Unquiet Mind: A Memoir of Moods and Madness,an-unquiet-mind-a-memoir-of-moods-and-madness_422/index.html,£21.30,../media/cache/00/29/002924b764dc367dcaa3486fa4c0aa0b.jpg,3
A Year in Provence (Provence #1),a-year-in-provence-provence-1_421/index.html,£56.88,../media/cache/db/46/db46159b05faa5d95262112bf9c29ddd.jpg,4
World Without End (The Pillars of the Earth #2),world-without-end-the-pillars-of-the-earth-2_420/index.html,£32.97,../media/cache/be/7c/be7ce6fbc9a8e1a5a5b5c32e73cfd78a.jpg,4
"Will Grayson, Will Grayson (Will Grayson, Will Grayson)",will-grayson-will-grayson-will-grayson-will-grayson_419/index.html,£47.31,../media/cache/de/a1/dea174c8a8dbfd98e5e05c9e479a52b2.jpg,4
Why Save the Bankers?: And Other Essays on Our Economic and Political Crisis,why-save-the-bankers-and-other-essays-on-our-economic-and-political-crisis_418/index.html,£48.67,../media/cache/16/f5/16f545b2e14c16ed4bd0e098a0700b57.jpg,2
Where She Went (If I Stay #2),where-she-went-if-i-stay-2_417/index.html,£41.73,../media/cache/05/86/0586b3d79013f606494e843de1faea0b.jpg,4
What If?: Serious Scientific Answers to Absurd Hypothetical Questions,what-if-serious-scientific-answers-to-absurd-hypothetical-questions_416/index.html,£53.68,../media/cache/59/bc/59bcc421ae9f5a6f12ef11e849fb745d.jpg,4
Two Summers,two-summers_415/index.html,£14.64,../media/cache/89/16/89165d7488fbaa9e60cfcabe56796288.jpg,1
This Is Your Brain on Music: The Science of a Human Obsession,this-is-your-brain-on-music-the-science-of-a-human-obsession_414/index.html,£38.40,../media/cache/35/a4/35a4a7c6c76c4e82186753078e441654.jpg,1
The Secret Garden,the-secret-garden_413/index.html,£15.08,../media/cache/c5/46/c5465a06182ed6ebfa40d049258a2f58.jpg,4
The Raven King (The Raven Cycle #4),the-raven-king-the-raven-cycle-4_412/index.html,£30.57,../media/cache/da/54/da54d953f00d1e465f31f865df3d0f3f.jpg,2
The Raven Boys (The Raven Cycle #1),the-raven-boys-the-raven-cycle-1_411/index.html,£57.74,../media/cache/3c/a4/3ca4889e4bb7f9a1cc1d7a1c920e9d42.jpg,4
The Power Greens Cookbook: 140 Delicious Superfood Recipes,the-power-greens-cookbook-140-delicious-superfood-recipes_410/index.html,£11.05,../media/cache/82/1d/821d2c02dcd0a10fc9d533917482746e.jpg,5
The Metamorphosis,the-metamorphosis_409/index.html,£28.58,../media/cache/4a/1b/4a1b6e9c1af75db0dc34ae63344f6883.jpg,1
The Mathews Men: Seven Brothers and the War Against Hitler's U-boats,the-mathews-men-seven-brothers-and-the-war-against-hitlers-u-boats_408/index.html,£42.91,../media/cache/f2/64/f26457d65a03b2636c4bcc7c318f7346.jpg,5
The Little Paris Bookshop,the-little-paris-bookshop_407/index.html,£24.73,../media/cache/50/a9/50a901fb008c0b8965c8d4da2dff5470.jpg,3
The Hiding Place,the-hiding-place_406/index.html,£55.91,../media/cache/cf/18/cf187c1dc5575fcbbf49c58024146c4b.jpg,4
The Grand Design,the-grand-design_405/index.html,£13.76,../media/cache/08/a9/08a957eb34f8047862e225774c3bdde2.jpg,3
The Firm,the-firm_404/index.html,£45.56,../media/cache/95/84/95847132a78de44b7249a2d0a3fe3ef6.jpg,3
The Fault in Our Stars,the-fault-in-our-stars_403/index.html,£47.22,../media/cache/69/61/696100859e82b2ec7a796129d6cca44a.jpg,1
The False Prince (The Ascendance Trilogy #1),the-false-prince-the-ascendance-trilogy-1_402/index.html,£56.00,../media/cache/f8/e3/f8e371e2869d13b9d89999f8d5173245.jpg,5
The Expatriates,the-expatriates_401/index.html,£44.58,../media/cache/db/e4/dbe49e1cb06136eeb51182f551ccdc52.jpg,2
The Dream Thieves (The Raven Cycle #2),the-dream-thieves-the-raven-cycle-2_400/index.html,£34.50,../media/cache/d9/7a/d97a3a4a65b5275ab506b28c7a88e0a5.jpg,1
The Darkest Corners,the-darkest-corners_399/index.html,£11.33,../media/cache/c1/ab/c1ab73a20d02b5f3a5599e7c5704a909.jpg,5
The Crossover,the-crossover_398/index.html,£38.77,../media/cache/9f/35/9f351ca1978128c60a3b7f85987075b3.jpg,4
The 5th Wave (The 5th Wave #1),the-5th-wave-the-5th-wave-1_397/index.html,£11.83,../media/cache/10/d0/10d0c5e47d0e8cce16b6b5e6be48cb16.jpg,2
Tell the Wind and Fire,tell-the-wind-and-fire_396/index.html,£45.51,../media/cache/3b/0c/3b0c5f4df26b73659af4e25107499384.jpg,3
Tell Me Three Things,tell-me-three-things_395/index.html,£41.81,../media/cache/a1/2f/a12f0bec8c8728800f901b4e5f6e3f9a.jpg,1
Talking to Girls About Duran Duran: One Young Man's Quest for True Love and a Cooler Haircut,talking-to-girls-about-duran-duran-one-young-mans-quest-for-true-love-and-a-cooler-haircut_394/index.html,£25.15,../media/cache/07/8b/078b934613af473daf7ecf918e05d050.jpg,4
Siddhartha,siddhartha_393/index.html,£34.22,../media/cache/ce/0b/ce0be2d86e388540122c222306c6d62c.jpg,5
Shiver (The Wolves of Mercy Falls #1),shiver-the-wolves-of-mercy-falls-1_392/index.html,£16.23,../media/cache/84/73/847399651d8f2dfae1a0d5a0ea4064b2.jpg,5
Remember Me?,remember-me_391/index.html,£11.48,../media/cache/3f/95/3f9572f94858197e92786b194f0f12df.jpg,3
Red Dragon (Hannibal Lecter #1),red-dragon-hannibal-lecter-1_390/index.html,£23.37,../media/cache/30/66/3066f8bcd2e2ed6b45084355ff084a61.jpg,3
Peak: Secrets from the New Science of Expertise,peak-secrets-from-the-new-science-of-expertise_389/index.html,£16.28,../media/cache/83/ab/83ab65f938b24fa1a9cb47235be49b57.jpg,2
My Mother Was Nuts,my-mother-was-nuts_388/index.html,£31.63,../media/cache/9b/b4/9bb42bf833e91193ca05badddded4bfb.jpg,4
Mexican Today: New and Rediscovered Recipes for Contemporary Kitchens,mexican-today-new-and-rediscovered-recipes-for-contemporary-kitchens_387/index.html,£24.91,../media/cache/5d/02/5d029bff299cdb777e06f35800faa628.jpg,5
Maybe Something Beautiful: How Art Transformed a Neighborhood,maybe-something-beautiful-how-art-transformed-a-neighborhood_386/index.html,£22.54,../media/cache/c0/bb/c0bb6e42743b9c1aaf9b754501100a5d.jpg,1
Lola and the Boy Next Door (Anna and the French Kiss #2),lola-and-the-boy-next-door-anna-and-the-french-kiss-2_385/index.html,£23.63,../media/cache/bc/c8/bcc8374e0c81ded1486b6225ca4fe78a.jpg,4
Logan Kade (Fallen Crest High #5.5),logan-kade-fallen-crest-high-55_384/index.html,£13.12,../media/cache/d9/4e/d94e6206c2decd3acd9a61b2cbac7eaf.jpg,2
Last One Home (New Beginnings #1),last-one-home-new-beginnings-1_383/index.html,£59.98,../media/cache/e4/0a/e40a336622fe578699be5a1eeba18f9d.jpg,3
Killing Floor (Jack Reacher #1),killing-floor-jack-reacher-1_382/index.html,£31.49,../media/cache/eb/e9/ebe9f06ccebf83d9853a846052b58fff.jpg,4
Kill the Boy Band,kill-the-boy-band_381/index.html,£15.52,../media/cache/05/74/0574a71ccaff1fef1f8e9a1f4c22b7bc.jpg,5
Isla and the Happily Ever After (Anna and the French Kiss #3),isla-and-the-happily-ever-after-anna-and-the-french-kiss-3_380/index.html,£48.13,../media/cache/0d/0b/0d0bd1fce3e0171cf101764393caea41.jpg,5
If I Stay (If I Stay #1),if-i-stay-if-i-stay-1_379/index.html,£38.13,../media/cache/cb/b3/cbb3754c7bae0d54dcf561aed4f9d6e3.jpg,5
I Know Why the Caged Bird Sings (Maya Angelou's Autobiography #1),i-know-why-the-caged-bird-sings-maya-angelous-autobiography-1_378/index.html,£36.55,../media/cache/c1/42/c14297e48de02ac420c587822ff329ab.jpg,2
Harry Potter and the Deathly Hallows (Harry Potter #7),harry-potter-and-the-deathly-hallows-harry-potter-7_377/index.html,£23.32,../media/cache/58/e4/58e434a6a4eb267eac7aa529b0c2ec15.jpg,1
